{
  "$id": "https://commandlayer.org/schemas/v1.1.0/commercial/authorize/authorize.request.schema.json",
  "$schema": "https://json-schema.org/draft/2020-12/schema",
  "title": "authorize.request",
  "description": "Reserve payment authority for a later commercial capture or settlement.",
  "type": "object",
  "additionalProperties": false,
  "$defs": {
    "money": {
      "type": "object",
      "additionalProperties": false,
      "required": [
        "amount",
        "currency"
      ],
      "properties": {
        "amount": {
          "type": "string",
          "pattern": "^(0|[1-9][0-9]*)(\\.[0-9]{1,6})?$",
          "maxLength": 40
        },
        "currency": {
          "type": "string",
          "pattern": "^[A-Z0-9]{2,16}$"
        },
        "decimals": {
          "type": "integer",
          "minimum": 0,
          "maximum": 18
        },
        "includes": {
          "type": "string",
          "enum": [
            "subtotal",
            "tax",
            "shipping",
            "fees",
            "discount",
            "total"
          ]
        }
      }
    },
    "payment_requirement": {
      "type": "object",
      "additionalProperties": false,
      "required": [
        "scheme",
        "resource",
        "max_amount"
      ],
      "properties": {
        "scheme": {
          "type": "string",
          "const": "x402"
        },
        "resource": {
          "type": "string",
          "format": "uri",
          "maxLength": 512
        },
        "network": {
          "type": "string",
          "maxLength": 64
        },
        "max_amount": {
          "$ref": "#/$defs/money"
        },
        "payment_request_id": {
          "type": "string",
          "minLength": 1,
          "maxLength": 128
        }
      }
    },
    "authorization_scope": {
      "type": "object",
      "additionalProperties": false,
      "required": [
        "capture_mode"
      ],
      "properties": {
        "capture_mode": {
          "type": "string",
          "enum": [
            "manual",
            "automatic"
          ]
        },
        "valid_until": {
          "type": "string",
          "format": "date-time"
        },
        "reusable": {
          "type": "boolean"
        }
      }
    },
    "actor_identity": {
      "type": "object",
      "additionalProperties": false,
      "required": [
        "role",
        "id"
      ],
      "properties": {
        "role": {
          "type": "string",
          "enum": [
            "payer",
            "payee",
            "merchant",
            "provider",
            "carrier",
            "verifier"
          ]
        },
        "id": {
          "type": "string",
          "minLength": 1,
          "maxLength": 128
        },
        "kind": {
          "type": "string",
          "enum": [
            "agent",
            "organization",
            "wallet",
            "account",
            "service",
            "human"
          ]
        },
        "display_name": {
          "type": "string",
          "maxLength": 128
        },
        "uri": {
          "type": "string",
          "format": "uri",
          "maxLength": 512
        }
      }
    },
    "payer_actor": {
      "allOf": [
        {
          "$ref": "#/$defs/actor_identity"
        },
        {
          "type": "object",
          "properties": {
            "role": {
              "const": "payer"
            }
          },
          "required": [
            "role"
          ]
        }
      ]
    },
    "payee_actor": {
      "allOf": [
        {
          "$ref": "#/$defs/actor_identity"
        },
        {
          "type": "object",
          "properties": {
            "role": {
              "const": "payee"
            }
          },
          "required": [
            "role"
          ]
        }
      ]
    },
    "merchant_actor": {
      "allOf": [
        {
          "$ref": "#/$defs/actor_identity"
        },
        {
          "type": "object",
          "properties": {
            "role": {
              "const": "merchant"
            }
          },
          "required": [
            "role"
          ]
        }
      ]
    },
    "provider_actor": {
      "allOf": [
        {
          "$ref": "#/$defs/actor_identity"
        },
        {
          "type": "object",
          "properties": {
            "role": {
              "const": "provider"
            }
          },
          "required": [
            "role"
          ]
        }
      ]
    },
    "carrier_actor": {
      "allOf": [
        {
          "$ref": "#/$defs/actor_identity"
        },
        {
          "type": "object",
          "properties": {
            "role": {
              "const": "carrier"
            }
          },
          "required": [
            "role"
          ]
        }
      ]
    },
    "verifier_actor": {
      "allOf": [
        {
          "$ref": "#/$defs/actor_identity"
        },
        {
          "type": "object",
          "properties": {
            "role": {
              "const": "verifier"
            }
          },
          "required": [
            "role"
          ]
        }
      ]
    },
    "reference": {
      "type": "object",
      "additionalProperties": false,
      "required": [
        "type",
        "id"
      ],
      "properties": {
        "type": {
          "type": "string",
          "enum": [
            "order",
            "invoice",
            "authorization",
            "checkout",
            "purchase",
            "fulfillment",
            "shipment",
            "payment",
            "settlement",
            "receipt",
            "payment_requirement",
            "payment_session",
            "payment_proof",
            "agent_card"
          ]
        },
        "id": {
          "type": "string",
          "minLength": 1,
          "maxLength": 128
        },
        "uri": {
          "type": "string",
          "format": "uri",
          "maxLength": 512
        }
      }
    }
  },
  "properties": {
    "protocol": {
      "type": "string",
      "const": "commercial"
    },
    "version": {
      "type": "string",
      "const": "1.1.0"
    },
    "verb": {
      "type": "string",
      "const": "authorize"
    },
    "request_id": {
      "type": "string",
      "minLength": 1,
      "maxLength": 128
    },
    "requested_at": {
      "type": "string",
      "format": "date-time"
    },
    "payer": {
      "$ref": "#/$defs/payer_actor"
    },
    "payee": {
      "$ref": "#/$defs/payee_actor"
    },
    "merchant": {
      "$ref": "#/$defs/merchant_actor"
    },
    "amount": {
      "$ref": "#/$defs/money"
    },
    "authorization_scope": {
      "$ref": "#/$defs/authorization_scope"
    },
    "payment_requirement": {
      "$ref": "#/$defs/payment_requirement"
    },
    "order_ref": {
      "$ref": "#/$defs/reference"
    },
    "invoice_ref": {
      "$ref": "#/$defs/reference"
    },
    "merchant_reference": {
      "type": "string",
      "minLength": 1,
      "maxLength": 128
    },
    "idempotency_key": {
      "type": "string",
      "minLength": 1,
      "maxLength": 128
    }
  },
  "required": [
    "protocol",
    "version",
    "verb",
    "request_id",
    "requested_at",
    "payer",
    "payee",
    "merchant",
    "amount",
    "authorization_scope"
  ]
}
