{
  "protocol": "commercial",
  "version": "1.1.0",
  "verb": "authorize",
  "request_id": "authreq-001",
  "requested_at": "2026-03-19T10:00:00Z",
  "payer": {
    "role": "payer",
    "id": "buyer-001",
    "kind": "account"
  },
  "payee": {
    "role": "payee",
    "id": "merchant-settlement",
    "kind": "wallet"
  },
  "merchant": {
    "role": "merchant",
    "id": "merchant.example",
    "kind": "organization"
  },
  "amount": {
    "amount": "49.99",
    "currency": "USDC",
    "decimals": 2
  },
  "authorization_scope": {
    "capture_mode": "manual",
    "valid_until": "2026-03-20T10:00:00Z",
    "reusable": false
  },
  "payment_requirement": {
    "scheme": "x402",
    "resource": "https://merchant.example/x402/authorize/authreq-001",
    "network": "eip155:8453",
    "max_amount": {
      "amount": "49.99",
      "currency": "USDC",
      "decimals": 2
    },
    "payment_request_id": "x402-auth-001"
  },
  "order_ref": {
    "type": "order",
    "id": "ord-1001"
  },
  "invoice_ref": {
    "type": "invoice",
    "id": "inv-1001"
  },
  "merchant_reference": "web-checkout-1001",
  "idempotency_key": "authorize-1001"
}
