{
  "protocol": "commercial",
  "version": "1.1.0",
  "verb": "authorize",
  "request_id": "authreq-002",
  "requested_at": "2026-03-19T10:02:00Z",
  "payer": {
    "role": "payer",
    "id": "buyer-002",
    "kind": "account"
  },
  "payee": {
    "role": "payee",
    "id": "merchant-settlement",
    "kind": "wallet"
  },
  "merchant": {
    "role": "merchant",
    "id": "merchant.example",
    "kind": "organization"
  },
  "amount": {
    "amount": "89.00",
    "currency": "USDC",
    "decimals": 2
  },
  "authorization_scope": {
    "capture_mode": "automatic",
    "valid_until": "2026-03-20T10:02:00Z",
    "reusable": true
  },
  "payment_requirement": {
    "scheme": "x402",
    "resource": "https://merchant.example/x402/authorize/authreq-002",
    "network": "eip155:8453",
    "max_amount": {
      "amount": "89.00",
      "currency": "USDC",
      "decimals": 2
    },
    "payment_request_id": "x402-auth-002"
  },
  "order_ref": {
    "type": "order",
    "id": "ord-1002"
  },
  "merchant_reference": "subscription-renewal-1002",
  "idempotency_key": "authorize-1002"
}
